[
  {
    "id": "mindbug_token",
    "name": "Mindbug",
    "kind": "token",
    "quantity": 2,
    "per_player": true,
    "description": "Spend one to steal the creature your opponent just played instead of letting them have it (see rules/rules.md §5a and §8). 2 per player, 4 total in the physical box — confirmed by the official rules sheet's component list (\"48 Creature Cards, Rules Sheet, 4 Mindbug Cards\").",
    "symbol": "mindbug"
  }
]
